{
  "version": 1,
  "checkedAt": "2026-10-29T20:54:44.912421+00:00",
  "scope": "Recorded official source matches. The sixth batch adds an independently re-downloaded FGV afternoon/type-1 pair and six official legal HTML references. Each initial official download matches its retained file by SHA-256. Planalto HTML rechecks differ in embedded scripts but have identical active visible text; separate recheck files and hashes are in data/reviews/legal-reference-rechecks.json. Older matches remain retained evidence, not fresh downloads. Active cited clauses reviewed as of 2026-10-23; no guarantee about future amendments. Seventh batch: four Câmara 2014 paper/key PDFs, the Enap communication plan and CERT.br reference were independently re-downloaded with identical bytes. Six publisher HTML references match their initial official downloads; no repeated binary comparison is claimed for them. Legal compatibility uses the cited official snapshots retained on 2026-10-23. Comment completion: two Priberam entries retain the initial official publisher download bytes; no independent second download is claimed. Ninth source discovery: 16 new paper/key PDFs independently re-downloaded with byte equality; two Microsoft Learn HTML references retain initial publisher bytes. Complete source inventory is separate from individually released questions. Existing matches are historical evidence; not every old source was downloaded again. Tenth batch: one PF 2025 Bloco II pair independently re-downloaded with identical bytes; three Câmara current legal HTML references retain initial official download bytes. Compatibility is limited to cited active clauses as of 2026-10-23. Other prior sources were not all downloaded again. Eleventh batch: SERPRO 2023 and STJ 2024 basic paper/definitive-key PDFs independently re-downloaded byte-identically. Initial Câmara improbity-law and Microsoft Teams HTML downloads retained. Current review is limited to cited clauses and technical conditions; older evidence remains historical. Resumed on 2026-10-26: IPv6 and DNS initial Microsoft Learn reference bytes retained; seven legal items rechecked against cited active official clauses and Teams conditions rechecked, with separate evidence in data/reviews/eleventh-reference-rechecks.json. No new questions use annulled STJ Power BI items. Twelfth batch: two complete CNJ/TCEAC paper and definitive-key pairs independently downloaded twice with matching bytes; historical records are not repeated downloads. Four initial official Câmara legal HTML downloads retained; no second binary download is claimed for HTML. Compatibility is limited to cited active clauses as of 2026-10-26. ABDI intake 2026-10-27: the user-provided 48-page opening notice is byte-identical to the PDF linked on the FGV psabdi page; its download hash is retained. Other rows retain their original verification dates and scopes; no fresh re-download of all sources is claimed. ABDI first batch 2026-10-27: three complete Senado/TCE-MG pairs independently downloaded twice with matching bytes. Three official Câmara legislative HTML references retain initial publisher bytes. Only the selected clauses are reviewed; five internal ABDI documents remain inaccessible/unverified. Other sources were not freshly re-downloaded. See abdi-first-source-discovery.json and abdi-first-reference-review.json. ABDI second batch: seven internal/reference PDFs (including original CD 008/2023 plan and distinct CD 009/2024 adjustment) and four official IBFC 2008 objective/post-appeal pairs independently re-downloaded byte-identically. New official Câmara LGPD HTML retains initial bytes; Planalto returned HTTP 503. No fresh re-download of all older sources is claimed. ABDI third batch: four additional IBFC 2008 paper/definitive post-appeal pairs, eight independent repeated byte matches. Existing Senate/LGPD/RLC sources reused with selected-clause checks; no whole-bank re-audit. ABDI fourth batch: six additional official pairs, eleven unique PDFs repeated byte-identically; shared Fiocruz final report retained once for two exact profiles. TJRR key header date discrepancy recorded against official notice. Older legal sources reused only at selected clauses. CGU Auditoria intake: original opening, rectification nº2 and updated opening independently re-downloaded byte-identically on 28/10/2026; event listing unchanged. Other evidence is historical. No new paper/key pairs or question texts. CGU first batch: two new TCEAC objective/definitive pairs and two CGU normative PDFs independently re-downloaded byte-identically. IN3 consolidated preserves partial revocation of 4(d) and 5 by IN7; selected clauses only. Lei4320/LRF same-day rechecks retained separately. No full MCASP11 verification; HTTP401 not bypassed. Older source matches retain historical scope. Reserve second batch: six annotated TCDF Auditoria question/final-key PDFs and two ABDI Biotecnologia PDFs independently repeated byte-identically. Preliminary annotations never grade questions. MCASP11 full PDF/change-summary matched twice but remain outside repository; official HTML landing and Lei12846 consolidated HTML retain initial downloaded bytes. Selected MCASP pages/clauses only, not an exhaustive manual audit. Gaps third batch: five complete official pairs/eight unique PDF binaries compared with independent repeated downloads; CGU uses retified20Apr2022 report and exact role/type/session, not preliminary or superseded tables. CNS510 and FENAJ initial publisher bytes retained; selected provisions only. Other source verification remains historical. Gaps fourth batch: five complete official pairs/ten unique repeated byte-identical PDFs. One new Lei12813 publisher HTML with selected-clause review; old source checks remain historical. ICMBio date discrepancy explicitly retained. Norms-gap fifth: five normative references independently repeated; Lei14133 alternate official DOCX checked at selected clauses. Existing paper/key verification dates retained; no fresh PDF download claim for existing pairs. Completion sixth: two complete CGE-SC role/session/type pairs, three unique PDFs repeated identically; five normative PDFs independently repeated, selected clauses/amendments only. Old dates/evidence remain historical. Seventh continuation: one CGE/CE2019 original MC pair and three official reference pages independently repeated byte-identically; selected-clause review only. DOU2279 pages2–4 are research evidence, not automatic permission to reuse an old exemption. Eighth expansion: five official complete pairs, independently repeated byte-identically; FGV current rectified key and TCDF002 explicit header discrepancy retained; selected normative clauses rechecked only.",
  "documents": [
    {
      "documentId": "camara-2026-edital-01-documento",
      "localSha256": "065cb0eb179e91107dd2edb1d92f0d0a86c0feb359fedd6e0b44329fc4b096e3",
      "outcome": "byte_match",
      "officialUrl": "https://www2.camara.leg.br/transparencia/recursos-humanos/concursos/arquivos-2025/edital-1-analista-legislativo-especialidades",
      "remoteSha256": "065cb0eb179e91107dd2edb1d92f0d0a86c0feb359fedd6e0b44329fc4b096e3"
    },
    {
      "documentId": "camara-2026-edital-05-documento",
      "localSha256": "1685ed892c8ae00c57cfca14b6c91cd5227b801df7f2a574f0f1d7286c810c87",
      "outcome": "byte_match",
      "officialUrl": "https://www2.camara.leg.br/transparencia/recursos-humanos/concursos/arquivos-2025/edital-n-5-cd-analista-especialidades-de-15-de-outubro-de-2026",
      "remoteSha256": "1685ed892c8ae00c57cfca14b6c91cd5227b801df7f2a574f0f1d7286c810c87"
    },
    {
      "documentId": "camara-2026-edital-06-documento",
      "localSha256": "0bdab0b074444077a3b3c38a9f492f119537e7437bf4d28f10b5e042a1764122",
      "outcome": "byte_match",
      "officialUrl": "https://www2.camara.leg.br/transparencia/recursos-humanos/concursos/arquivos-2025/edital-n-6-cd-especialidades-de-21-de-outubro-de-2026",
      "remoteSha256": "0bdab0b074444077a3b3c38a9f492f119537e7437bf4d28f10b5e042a1764122"
    },
    {
      "documentId": "source-232funprespexe-cb1-01-paper",
      "localSha256": "c8604cb8ff215b848e10327140e60a72fbe8adadac66c23ce35c242d3761d73f",
      "outcome": "byte_match",
      "officialUrl": "https://cdn.cebraspe.org.br/concursos/FUNPRESP_15/arquivos/232FUNPRESPEXE_CB1_01.PDF",
      "remoteSha256": "c8604cb8ff215b848e10327140e60a72fbe8adadac66c23ce35c242d3761d73f"
    },
    {
      "documentId": "source-232funprespexe-cb1-01-key",
      "localSha256": "33448aec7403003f8f7bbc6390facffd245a2142eef416ace35087280b1fbfe4",
      "outcome": "byte_match",
      "officialUrl": "https://cdn.cebraspe.org.br/concursos/FUNPRESP_15/arquivos/GAB_DEFINITIVO_232FUNPRESPEXE_CB1_01.PDF",
      "remoteSha256": "33448aec7403003f8f7bbc6390facffd245a2142eef416ace35087280b1fbfe4"
    },
    {
      "documentId": "source-232funprespexe-002-01-paper",
      "localSha256": "55488e51fdd824a03f06083527a94fbfbe296378f21866d69ae0cb389184a96e",
      "outcome": "byte_match",
      "officialUrl": "https://cdn.cebraspe.org.br/concursos/FUNPRESP_15/arquivos/232FUNPRESPEXE_002_01.PDF",
      "remoteSha256": "55488e51fdd824a03f06083527a94fbfbe296378f21866d69ae0cb389184a96e"
    },
    {
      "documentId": "source-232funprespexe-002-01-key",
      "localSha256": "6bd16422a18dde8bb80a188ca0ac8704dd3d23a1635a6081a17bdafacf59ba5d",
      "outcome": "byte_match",
      "officialUrl": "https://cdn.cebraspe.org.br/concursos/FUNPRESP_15/arquivos/GAB_DEFINITIVO_232FUNPRESPEXE_002_01.PDF",
      "remoteSha256": "6bd16422a18dde8bb80a188ca0ac8704dd3d23a1635a6081a17bdafacf59ba5d"
    },
    {
      "documentId": "source-038-anm-010-01-paper",
      "localSha256": "ea76f07905a3e89245b9e23c97330141329f244e9d4cbb312076eb46fb580335",
      "outcome": "byte_match",
      "officialUrl": "https://cdn.cebraspe.org.br/concursos/ANM_24/arquivos/038_ANM_010_01.PDF",